[
  {
    "id": "resource:ai-code-assistant",
    "kind": "ai-agent",
    "name": "AI Code Assistant",
    "slug": "ai-code-assistant",
    "owner": "AI Enablement",
    "team": "ai-platform",
    "workspace": "ai",
    "lifecycle": "beta",
    "status": "active",
    "visibility": "internal",
    "version": "0.9.2",
    "summary": "An AI agent that navigates the context fabric and control plane to summarize architecture, review Posture, and answer engineering questions.",
    "capabilities": ["ai-agent", "context-retrieval", "review", "assistant"],
    "languages": ["typescript"],
    "frameworks": ["node"],
    "relationships": [
      { "type": "uses", "target": "resource:context-fabric" },
      { "type": "uses", "target": "resource:ai-runtime" }
    ],
    "health": { "score": 85, "status": "healthy" },
    "ai": { "contextBundle": true, "promptRegistry": true, "agentReady": true, "readiness": 88 },
    "tags": ["ai", "agent", "assistant"],
    "updatedAt": "2026-08-07"
  },
  {
    "id": "resource:helm-charts-registry",
    "kind": "helm-chart",
    "name": "Helm Charts",
    "slug": "helm-charts-registry",
    "owner": "Core Infrastructure",
    "team": "core-infrastructure",
    "workspace": "core-infrastructure",
    "lifecycle": "supported",
    "status": "active",
    "visibility": "public",
    "version": "2.1.3",
    "summary": "Versioned Helm charts packaging workhorse services and their deployment topology for Kubernetes targets.",
    "capabilities": ["helm-chart", "deployment", "kubernetes"],
    "languages": ["yaml"],
    "frameworks": ["helm", "kubernetes"],
    "relationships": [
      { "type": "deploys", "target": "resource:deployment-runtime" },
      { "type": "part_of", "target": "resource:khulnasoft-platform" }
    ],
    "health": { "score": 91, "status": "healthy" },
    "deployment": { "targets": ["kubernetes"], "environment": "production", "status": "active" },
    "ai": { "contextBundle": true, "promptRegistry": false, "agentReady": true, "readiness": 84 },
    "tags": ["kubernetes", "deployment", "infra"],
    "updatedAt": "2026-08-07"
  }
]